{
  "version": "1.0.0",
  "schemaVersion": "2.0.0",
  "project": "LLMGateway",
  "status": "draft",
  "goalSpecVersion": "v1.0.0",
  "overview": {
    "summary": "LLMGateway is a single-process local service that intercepts developer queries, classifies their complexity, routes them to the most appropriate backend, and returns the response. It exposes an OpenAI-compatible HTTP interface so existing tooling requires no changes. All state is local; no cloud dependency is required for operation.",
    "subsystems": [
      {
        "name": "Ingress",
        "purpose": "Accepts incoming queries and normalises them to an internal format.",
        "componentRefs": [
          "COMP-000-APIServer"
        ]
      },
      {
        "name": "Routing",
        "purpose": "Classifies queries and selects the appropriate backend.",
        "componentRefs": [
          "COMP-001-Classifier",
          "COMP-002-Router"
        ]
      },
      {
        "name": "Backend Execution",
        "purpose": "Dispatches queries to configured backends and collects responses.",
        "componentRefs": [
          "COMP-003-BackendPool",
          "COMP-004-LocalAdapter",
          "COMP-005-CloudAdapter"
        ]
      },
      {
        "name": "Observability",
        "purpose": "Records query history and routing decisions for developer inspection.",
        "componentRefs": [
          "COMP-006-QueryLog"
        ]
      },
      {
        "name": "Configuration",
        "purpose": "Loads and validates user-supplied backend configuration at startup.",
        "componentRefs": [
          "COMP-007-ConfigLoader"
        ]
      }
    ]
  },
  "components": [
    {
      "id": "COMP-000-Server",
      "name": "API Server",
      "purpose": "Exposes an OpenAI-compatible HTTP interface and translates requests into internal query objects.",
      "responsibilities": [
        "Accept HTTP requests on the configured port.",
        "Validate and parse incoming request payloads.",
        "Translate OpenAI-format requests to internal Query objects.",
        "Return responses in OpenAI-compatible format.",
        "Enforce request size limits."
      ],
      "dependencies": [
        "COMP-002-Router"
      ],
      "reqRefs": [
        "REQ-001-Login"
      ],
      "visibility": "external",
      "description": "Component: API Server"
    },
    {
      "id": "COMP-001-Classifier",
      "name": "Query Classifier",
      "purpose": "Assigns a complexity tier to each query to inform routing decisions.",
      "responsibilities": [
        "Analyse query content and estimate complexity.",
        "Assign a tier label (e.g. simple, moderate, complex) to each query.",
        "Operate within a bounded latency budget to avoid adding routing overhead."
      ],
      "dependencies": [],
      "reqRefs": [
        "REQ-001-Login"
      ],
      "nfrRefs": [
        "NFR-001-Availability"
      ],
      "visibility": "internal",
      "description": "Analyzes query content to assign a Complexity Tier (simple or complex) for routing decisions."
    },
    {
      "id": "COMP-002-Router",
      "name": "Router",
      "purpose": "Selects the appropriate backend for a query based on classification, availability, and configured priority.",
      "responsibilities": [
        "Receive classified queries and select a backend.",
        "Respect user-configured backend priority order.",
        "Detect unavailable backends and trigger fallback.",
        "Pass explicit backend overrides through without reclassification."
      ],
      "dependencies": [
        "COMP-001-Classifier",
        "COMP-003-BackendPool",
        "COMP-007-ConfigLoader"
      ],
      "reqRefs": [
        "REQ-001-Login",
        "REQ-004-UpdateProfile",
        "REQ-005-ProfileManagement"
      ],
      "nfrRefs": [
        "NFR-001-Availability",
        "NFR-002-Security"
      ],
      "visibility": "internal",
      "description": "Routes queries using Route Decision logic. Selects backends by Priority Order with Fallback support. Adds minimal Routing Overhead."
    },
    {
      "id": "COMP-003-BackendPool",
      "name": "Backend Pool",
      "purpose": "Maintains the registry of configured backends and their current availability status.",
      "responsibilities": [
        "Store the list of configured backends and their metadata.",
        "Track availability state of each backend.",
        "Expose backend selection interface to the Router.",
        "Perform periodic health checks on configured backends."
      ],
      "dependencies": [
        "COMP-007-ConfigLoader"
      ],
      "reqRefs": [
        "REQ-002-Logout",
        "REQ-005-ProfileManagement"
      ],
      "visibility": "internal",
      "description": "Manages the Backend Pool of Local Backend and Cloud Backend endpoints, including OpenAI-compatible APIs."
    },
    {
      "id": "COMP-004-LocalAdapter",
      "name": "Local Backend Adapter",
      "purpose": "Dispatches queries to locally-running LLM backends such as llama.cpp or LM Studio.",
      "responsibilities": [
        "Translate internal Query objects to the local backend's native format.",
        "Send requests and receive responses from local backends.",
        "Report backend errors to the Router for fallback handling."
      ],
      "dependencies": [
        "COMP-003-BackendPool"
      ],
      "reqRefs": [
        "REQ-001-Login"
      ],
      "nfrRefs": [
        "NFR-003-Scalability"
      ],
      "visibility": "internal",
      "description": "Communicates with Local Backend instances. Supports Override for manual routing."
    },
    {
      "id": "COMP-005-CloudAdapter",
      "name": "Cloud Backend Adapter",
      "purpose": "Dispatches queries to remote cloud LLM APIs such as OpenRouter or Anthropic.",
      "responsibilities": [
        "Translate internal Query objects to the target cloud API format.",
        "Manage API key injection for cloud requests.",
        "Handle cloud-specific rate limiting and retry logic.",
        "Report backend errors to the Router for fallback handling."
      ],
      "dependencies": [
        "COMP-003-BackendPool"
      ],
      "reqRefs": [
        "REQ-001-Login"
      ],
      "visibility": "internal",
      "description": "Communicates with Cloud Backend instances via HTTP."
    },
    {
      "id": "COMP-006-QueryLog",
      "name": "Query Log",
      "purpose": "Persists a record of each query, routing decision, backend used, and response latency.",
      "responsibilities": [
        "Write a structured log entry for every completed query.",
        "Expose a query history read interface for developer inspection.",
        "Enforce log retention limits to prevent unbounded disk growth."
      ],
      "dependencies": [],
      "reqRefs": [
        "REQ-003-ResetPassword"
      ],
      "visibility": "internal",
      "description": "Component: Query Log"
    },
    {
      "id": "COMP-007-ConfigLoader",
      "name": "Config Loader",
      "purpose": "Loads, validates, and hot-reloads user-supplied backend configuration from disk.",
      "responsibilities": [
        "Parse configuration file from disk at startup.",
        "Validate configuration structure and required fields.",
        "Expose validated configuration to other components.",
        "Watch for configuration file changes and reload without restart."
      ],
      "dependencies": [],
      "reqRefs": [
        "REQ-002-Logout"
      ],
      "visibility": "internal",
      "description": "Component: Config Loader"
    }
  ],
  "dataModel": {
    "dataSpecRef": "example.dataspec.json",
    "notes": "All entities (Query, Backend, RouteDecision, LogEntry) are defined in the DataSpec. The architecture treats them as immutable value objects passed between components \u2014 no component mutates another component's entity."
  },
  "apiContract": {
    "apiSpecRef": "example.apispec.json",
    "authStrategy": "Local Unix socket or localhost-only HTTP \u2014 no authentication required for single-user local deployment. API key injection for cloud backends is handled internally by the Cloud Adapter and is never exposed to the caller.",
    "notes": "The external interface is intentionally OpenAI-compatible so that existing tools (Continue, Aider, OpenCode) require no reconfiguration."
  },
  "dataFlow": [
    {
      "id": "FLW-000-QueryRoutingFlow",
      "name": "Query Routing Flow",
      "description": "The primary path a developer query takes from ingress to response.",
      "reqRefs": [
        "REQ-001-Login",
        "REQ-005-ProfileManagement"
      ],
      "steps": [
        {
          "componentRef": "COMP-000-Server",
          "action": "Receives HTTP request and parses it into a Query object.",
          "dataRef": "Query"
        },
        {
          "componentRef": "COMP-001-Classifier",
          "action": "Assigns a complexity tier to the Query.",
          "dataRef": "Query"
        },
        {
          "componentRef": "COMP-002-Router",
          "action": "Selects the appropriate backend based on tier and availability.",
          "dataRef": "RouteDecision"
        },
        {
          "componentRef": "COMP-004-LocalAdapter",
          "action": "Dispatches Query to the selected local backend and awaits response.",
          "dataRef": "Query",
          "notes": "If selected backend is cloud, cloud-adapter handles this step instead."
        },
        {
          "componentRef": "COMP-006-QueryLog",
          "action": "Writes a log entry with backend used, latency, and outcome.",
          "dataRef": "LogEntry"
        },
        {
          "componentRef": "COMP-000-Server",
          "action": "Returns response to the caller in OpenAI-compatible format.",
          "dataRef": "Query"
        }
      ]
    },
    {
      "id": "FLW-001-FallbackFlow",
      "name": "Backend Fallback Flow",